### ISSUE TITLE
Why does DNS resolution occur for every request?

### ISSUE THREAD

**Issue by wuxi889** [guzzle/guzzle#3253]
**Guzzle version(s) affected**: 7.8.1
**PHP version**: 8.1.27
**cURL version**: 8.5.0

**Description**  

In my queue program, I have a significant number of requests made to external services. Reducing DNS resolution would help improve the efficiency of my queue consumption. However, despite trying various methods, DNS resolution still occurs for every request, unless I use `CURLOPT_RESOLVE`.

**How to reproduce**  

```php
// GuzzleRetryTrait.php
<?php

declare(strict_types=1);

namespace App\Traits;

trait GuzzleRetryTrait
{
    public static function retryDelay()
    {
        return function ($numberOfRetries) {
            return 300;
        };
    }

    public static function retryDecider()
    {
        return function (
            int $retries,
            \GuzzleHttp\Psr7\Request $request,
            \GuzzleHttp\Psr7\Response $response = null,
            \Exception $exception = null
        ) {
            if ($retries >= 3) {
                return false;
            }
            if ($exception instanceof \GuzzleHttp\Exception\ConnectException) {
                return true;
            }
            if ($response && $response->getStatusCode() >= 500) {
                return true;
            }

            return false;
        };
    }
}
```

```php
<?php

namespace App\Utils;

use App\Traits\GuzzleRetryTrait;
use GuzzleHttp\Client;
use GuzzleHttp\Handler\CurlHandler;
use GuzzleHttp\HandlerStack;
use GuzzleHttp\Middleware;

use function Hyperf\Config\config;

class GuzzleClient
{
    use GuzzleRetryTrait;

    public static function HandlerStack(array $middlewares = []): HandlerStack
    {
        $handlerStack = HandlerStack::create(new CurlHandler());

        $handlerStack->push(Middleware::retry(self::retryDecider(), self::retryDelay()));

        foreach ($middlewares as $middleware) {
            if (is_callable($middleware)) {
                $handlerStack->push($middleware);
            }
        }

        return $handlerStack;
    }

    public static function Instance(array $extraOptions = []): Client
    {
        $handlerStack = self::HandlerStack();

        return new Client(array_merge([
            'base_uri' => 'https://graph.facebook.com',
            'headers' => [
                'Content-Type' => 'application/json',
                'Connection' => 'keep-alive',
                'Keep-Alive' => 'timeout=15, max=1000',
            ],
            'handler' => $handlerStack,
            'curl' => [
                CURLOPT_FORBID_REUSE => false,
                CURLOPT_FRESH_CONNECT => false,
            ],
            'debug' => true,
        ], $extraOptions));
    }
}
```
```php
// GuzzleFactory.php
<?php

declare(strict_types=1);

namespace App\Factories;

use App\Utils\GuzzleClient;
use GuzzleHttp\Client;

class GuzzleFactory
{
    public function __invoke(): Client
    {
        return GuzzleClient::Instance();
    }
}

```
```php
// config/dependencies.php
<?php

declare(strict_types=1);

return [
    \GuzzleHttp\Client::class => \App\Factories\GuzzleFactory::class,
];
```
```php
// ConsumeService.php
<?php

declare(strict_types=1);

namespace App\Service;

use GuzzleHttp\Client;

class ConsumeService
{
    // @annotation
    private static Client $client;

    public function post()
    {
        $response = $this::$client->post($endpoint, [
            RequestOptions::JSON => $data,
        ]);
    }
```

**Possible Solution**  

What steps can I take to reduce the number of DNS resolutions in my application?

**Additional context**  

** Host was resolved every time**
```bash
* Host graph.facebook.com:443 was resolved.
* IPv6: 2a03:2880:f031:12:face:b00c:0:2
* IPv4: 157.240.22.19
*   Trying 157.240.22.19:443...
* Connected to graph.facebook.com (157.240.22.19) port 443
* ALPN: curl offers http/1.1
*  CAfile: /etc/ssl/certs/ca-certificates.crt
*  CApath: /etc/ssl/certs
* SSL connection using TLSv1.3 / TLS_CHACHA20_POLY1305_SHA256 / X25519 / id-ecPublicKey
* ALPN: server accepted http/1.1
* Server certificate:
*  subject: C=US; ST=California; L=Menlo Park; O=Meta Platforms, Inc.; CN=*.facebook.com
*  start date: Jun 22 00:00:00 2024 GMT
*  expire date: Sep 20 23:59:59 2024 GMT
*  subjectAltName: host "graph.facebook.com" matched cert's "*.facebook.com"
*  issuer: C=US; O=DigiCert Inc; OU=www.digicert.com; CN=DigiCert SHA2 High Assurance Server CA
*  SSL certificate verify ok.
*   Certificate level 0: Public key type EC/prime256v1 (256/128 Bits/secBits), signed using sha256WithRSAEncryption
*   Certificate level 1: Public key type RSA (2048/112 Bits/secBits), signed using sha256WithRSAEncryption
*   Certificate level 2: Public key type RSA (2048/112 Bits/secBits), signed using sha1WithRSAEncryption
* using HTTP/1.x
> POST /v19.0/{pixel}/events?access_token=
HTTP/1.1
Host: graph.facebook.com
Connection: keep-alive
Keep-Alive: timeout=15, max=1000
User-Agent: GuzzleHttp/7
Content-Type: application/json
Content-Length: 667

< HTTP/1.1 200 OK
< Content-Type: text/javascript; charset=UTF-8
< Vary: Origin
< cross-origin-resource-policy: cross-origin
< x-app-usage: {"call_count":0,"total_cputime":0,"total_time":0}
< Access-Control-Allow-Origin: *
< facebook-api-version: v19.0
< Strict-Transport-Security: max-age=15552000; preload
< Pragma: no-cache
< Cache-Control: private, no-cache, no-store, must-revalidate
< Expires: Sat, 01 Jan 2000 00:00:00 GMT
< x-fb-request-id: AkfNlRpXh1EMN0bsdwVhzWP
< x-fb-trace-id: GeevDRoMYXQ
< x-fb-rev: 1016465113
< X-FB-Debug: xrKjZubQ1rdsLycpl8GzWGZSpqzLcdtKRk786ZbmzpaJhcngX1F8aw+esfOsTCtP5EB6rJcmQ4+r04r6uRJc9Q==
< x-fb-server-load: 39
< Date: Fri, 13 Sep 2024 05:55:38 GMT
< X-FB-Connection-Quality: GOOD; q=0.7, rtt=147, rtx=0, c=10, mss=1338, tbw=3427, tp=-1, tpl=-1, uplat=124, ullat=0
< Alt-Svc: h3=":443"; ma=86400
< Connection: keep-alive
< Content-Length: 74
< 
* Connection #0 to host graph.facebook.com left intact
* Host graph.facebook.com:443 was resolved.
* IPv6: 2a03:2880:f031:12:face:b00c:0:2
* IPv4: 157.240.22.19
*   Trying 157.240.22.19:443...
* Connected to graph.facebook.com (157.240.22.19) port 443
* ALPN: curl offers http/1.1
* SSL reusing session ID
*  CAfile: /etc/ssl/certs/ca-certificates.crt
*  CApath: /etc/ssl/certs
* SSL connection using TLSv1.3 / TLS_CHACHA20_POLY1305_SHA256 / X25519 / UNDEF
* ALPN: server accepted http/1.1
* Server certificate:
*  subject: C=US; ST=California; L=Menlo Park; O=Meta Platforms, Inc.; CN=*.facebook.com
*  start date: Jun 22 00:00:00 2024 GMT
*  expire date: Sep 20 23:59:59 2024 GMT
*  subjectAltName: host "graph.facebook.com" matched cert's "*.facebook.com"
*  issuer: C=US; O=DigiCert Inc; OU=www.digicert.com; CN=DigiCert SHA2 High Assurance Server CA
*  SSL certificate verify ok.
* using HTTP/1.x
> POST /v19.0/{pixel}/events?access_token=
HTTP/1.1
Host: graph.facebook.com
Connection: keep-alive
Keep-Alive: timeout=15, max=1000
User-Agent: GuzzleHttp/7
Content-Type: application/json
Content-Length: 667

* old SSL session ID is stale, removing
< HTTP/1.1 200 OK
< Content-Type: text/javascript; charset=UTF-8
< Vary: Origin
< cross-origin-resource-policy: cross-origin
< x-app-usage: {"call_count":0,"total_cputime":0,"total_time":0}
< Access-Control-Allow-Origin: *
< facebook-api-version: v19.0
< Strict-Transport-Security: max-age=15552000; preload
< Pragma: no-cache
< Cache-Control: private, no-cache, no-store, must-revalidate
< Expires: Sat, 01 Jan 2000 00:00:00 GMT
< x-fb-request-id: APWXgPBVvl1jle905JfkxOM
< x-fb-trace-id: BMj8Yu/8o3c
< x-fb-rev: 1016465113
< X-FB-Debug: k9fXdaRbSb3JZWgrsPStCPIuw78SJ51M95zsK4s8mjVyuPfwmZKidIXaNove6+VqrS3q9yWu1Tu8fpIZKuLWug==
< x-fb-server-load: 21
< Date: Fri, 13 Sep 2024 05:55:39 GMT
< X-FB-Connection-Quality: MODERATE; q=0.3, rtt=152, rtx=0, c=10, mss=1338, tbw=395, tp=-1, tpl=-1, uplat=210, ullat=0
< Alt-Svc: h3=":443"; ma=86400
< Connection: keep-alive
< Content-Length: 74
< 
* Connection #0 to host graph.facebook.com left intact
```

**Comment by GrahamCampbell** [comment]
DNS should be cached between requests, in accordance with the TTL on the record coming from the server, so long as the same Guzzle client is used. If you are running PHP FPM, the Guzzle client will not be persisted between runs. I'm not sure the host was resolved message necessarily means it actually did the resolution - I think it also prints that when it comes from cURL's resolver cache.

**Comment by GrahamCampbell** [comment]
Are you able to use something like wireshark to see if the DNS lookup is actually going out?

**Comment by wuxi889** [comment]
> Are you able to use something like wireshark to see if the DNS lookup is actually going out?
@GrahamCampbell Yes, I monitored the traffic using tcpdump and confirmed that DNS resolution is happening with every request.

```bash 
[root@localhost]/home/www/project# tcpdump -i any port 53 | grep " A? graph.facebook.com"
dropped privs to tcpdump
tcpdump: verbose output suppressed, use -v or -vv for full protocol decode
listening on any, link-type LINUX_SLL (Linux cooked v1), capture size 262144 bytes
16:16:52.108313 IP 172.17.0.2.48851 > cache-fz.fj133165.com.domain: 41023+ A? graph.facebook.com. (36)
16:16:52.108336 IP 172.17.0.2.48851 > cache-fz.fj133165.com.domain: 41023+ A? graph.facebook.com. (36)
16:16:52.108381 IP localhost.localdomain.48851 > cache-fz.fj133165.com.domain: 41023+ A? graph.facebook.com. (36)
16:16:52.178255 IP 172.17.0.2.39369 > cache-fz.fj133165.com.domain: 51955+ A? graph.facebook.com. (36)
16:16:52.178276 IP 172.17.0.2.39369 > cache-fz.fj133165.com.domain: 51955+ A? graph.facebook.com. (36)
16:16:52.178303 IP localhost.localdomain.39369 > cache-fz.fj133165.com.domain: 51955+ A? graph.facebook.com. (36)
16:16:52.237522 IP 172.17.0.2.53452 > cache-fz.fj133165.com.domain: 35210+ A? graph.facebook.com. (36)
16:16:52.237552 IP 172.17.0.2.53452 > cache-fz.fj133165.com.domain: 35210+ A? graph.facebook.com. (36)
16:16:52.237591 IP localhost.localdomain.53452 > cache-fz.fj133165.com.domain: 35210+ A? graph.facebook.com. (36)
16:16:52.276624 IP 172.17.0.2.48489 > cache-fz.fj133165.com.domain: 23348+ A? graph.facebook.com. (36)
16:16:52.276647 IP 172.17.0.2.48489 > cache-fz.fj133165.com.domain: 23348+ A? graph.facebook.com. (36)
16:16:52.276691 IP localhost.localdomain.48489 > cache-fz.fj133165.com.domain: 23348+ A? graph.facebook.com. (36)
16:17:41.180145 IP 172.17.0.2.35540 > cache-fz.fj133165.com.domain: 16771+ A? graph.facebook.com. (36)
16:17:41.180182 IP 172.17.0.2.35540 > cache-fz.fj133165.com.domain: 16771+ A? graph.facebook.com. (36)
16:17:41.180231 IP localhost.localdomain.35540 > cache-fz.fj133165.com.domain: 16771+ A? graph.facebook.com. (36)
```

**Comment by wuxi889** [comment]
> DNS should be cached between requests, in accordance with the TTL on the record coming from the server, so long as the same Guzzle client is used. If you are running PHP FPM, the Guzzle client will not be persisted between runs. I'm not sure the host was resolved message necessarily means it actually did the resolution - I think it also prints that when it comes from cURL's resolver cache.

I'm using Swoole and AMQP to consume the queue, and the queue runs as a long-lived, memory-resident process, not under PHP-FPM.

**Comment by GrahamCampbell** [comment]
The issue is possibly that you are making a new client over and over, looking at your code, there.

**Comment by GrahamCampbell** [comment]
Can confirm with a log in `GuzzleFactory`.

**Comment by wuxi889** [comment]
> The issue is possibly that you are making a new client over and over, looking at your code, there.
@GrahamCampbell I have considered this scenario as well. However, after outputting the `spl_object_id` of the client object, I confirmed that they are consistent.
