### ISSUE TITLE
Half second delay between TCP ACK and Client Hello

### ISSUE THREAD

**Issue by pan-christensen** [guzzle/guzzle#2023]
Not sure if this is a bug or an incorrect setting.

I've been debugging some new code that performs much slower than expected. I've found that there's an added delay when using guzzle to post to our API. This delay does not occur when using the browser or curl command-line.

I've created a small debug script calling the ping function of our API. I initially used microtime and then I found TransferStats:
EDIT: I see that the xml body of the request is not displayed.
`<?php

require 'vendor/autoload.php';

use GuzzleHttp\Client;
use GuzzleHttp\TransferStats;

$starttime = microtime(true);
$client = new Client(['base_uri' => 'https://xxxxx.xxx/']);
$created = microtime(true);

$br = $client->request('POST', 'yyyyy/yyy', ['body' => '<Envelope xmlns="http://schemas.xmlsoap.org/soap/envelope/">
  <Body>
    <ping xmlns="http://zzzzz.zzz/"/>
  </Body>
</Envelope>',
  'on_stats' => function (TransferStats $stats) {
    echo $stats->getEffectiveUri() . "\n";
    echo $stats->getTransferTime() . "\n";
    var_dump($stats->getHandlerStats());

    // You must check if a response was received before using the
    // response object.
    if ($stats->hasResponse()) {
      echo $stats->getResponse()->getStatusCode();
    } else {
      // Error data is handler specific. You will need to know what
      // type of error data your handler uses before using this
      // value.
      var_dump($stats->getHandlerErrorData());
    }
  }
]);
$sent = microtime(true);

$createtime = $created - $starttime;
$sendtime = $sent - $created;
$totaltime = $sent - $starttime;

echo "\n\ncreate instance: $createtime, send request: $sendtime, total: $totaltime\n";

?>
`

The output of this script is:
https://xxxxx.xxx/yyyyy/yyy
0.718
array(26) {
  ["url"]=>
  string(58) "https://xxxxx.xxx/yyyyy/yyy"
  ["content_type"]=>
  string(22) "text/xml;charset=UTF-8"
  ["http_code"]=>
  int(200)
  ["header_size"]=>
  int(241)
  ["request_size"]=>
  int(276)
  ["filetime"]=>
  int(-1)
  ["ssl_verify_result"]=>
  int(0)
  ["redirect_count"]=>
  int(0)
  ["total_time"]=>
  float(0.718)
  ["namelookup_time"]=>
  float(0.062)
  ["connect_time"]=>
  float(0.062)
  ["pretransfer_time"]=>
  float(0.64)
  ["size_upload"]=>
  float(126)
  ["size_download"]=>
  float(206)
  ["speed_download"]=>
  float(206)
  ["speed_upload"]=>
  float(126)
  ["download_content_length"]=>
  float(-1)
  ["upload_content_length"]=>
  float(126)
  ["starttransfer_time"]=>
  float(0.703)
  ["redirect_time"]=>
  float(0)
  ["redirect_url"]=>
  string(0) ""
  ["primary_ip"]=>
  string(13) "xxx.xxx.xxx.xxx"
  ["certinfo"]=>
  array(0) {
  }
  ["primary_port"]=>
  int(443)
  ["local_ip"]=>
  string(12) "172.17.4.151"
  ["local_port"]=>
  int(50760)
}
200

create instance: 0.0057761669158936, send request: 0.72745704650879, total: 0.73323321342468

I noticed that the pretransfer_time and starttransfer_time values were much higher than expected, so I started sniffing the network traffic.

Here are the relevant packets from Wireshark:
123	4.160783	172.17.4.151	xxx.xxx.xxx.xxx	TCP	66	50760 → 443 [SYN] Seq=0 Win=64240 Len=0 MSS=1460 WS=256 SACK_PERM=1
124	4.163306	xxx.xxx.xxx.xxx	172.17.4.151	TCP	66	443 → 50760 [SYN, ACK] Seq=0 Ack=1 Win=29200 Len=0 MSS=1380 SACK_PERM=1 WS=128
125	4.163366	172.17.4.151	xxx.xxx.xxx.xxx	TCP	54	50760 → 443 [ACK] Seq=1 Ack=1 Win=66048 Len=0
150	4.727044	172.17.4.151	xxx.xxx.xxx.xxx	TLSv1.2	571	Client Hello

This is as far as I got in the debugging. I don't understand why this delay happens.
![guzzle_pcap](https://user-images.githubusercontent.com/19684494/37201571-6010cb2e-2388-11e8-8ba8-768b3bbd9c2f.jpg)
